{
  "artifact_id": "art_01HXZ7Z8R2QQSN5B3T5VQ4D1WA",
  "certificate_id": "cert_01HXZ803C0R6V4K4P9HWB6J5N6",
  "decision_record_id": "dec_01HXZ80MCP6KNB8M3D0W1MSZV9",
  "dataset_id": "ds_01HXZ811N6C84YFJ4S2P7A5R1K",
  "receipt_hash": "sha256:3a6e0f8ed8c1f9d6f4d5b2a0cc6f12f876afc8b64c50d8b4c2c6aef6bd2b21f0",
  "external_reference": "partner:invoice-44821",
  "provenance_metadata": {
    "cdp:source_system": "partner_portal",
    "cdp:workflow_id": "wf_2026_04_06_001"
  }
}
